id,text
1113927095162249216w,"RT @Crcarter97: If i pull up beside you at a stop light sharing the lane, I’m not being a dick head i just don’t wanna get crushed between…"
1113927211470458882x,"RT @VFBInsurance: April is Distracted Driving Awareness Month. Did you know, texting while driving  increases your likelihood of being invo…"
1113929833552080896y,RT @flcourier: Tougher texting while driving bill advances ... https://t.co/y1Nm5VLsyK  A proposal that would make it easier for police to…
1113930726909599746z,"Ahh, spring driving in Alberta- where you never know if the driver in front of you is swerving because they’re impaired, texting, or trying to avoid being swallowed whole by a pot hole."
1113930912125702144a,"According to the US Department of Transportation’s (USDOT) National Highway Traffic Safety Administration (NHTSA), in 2016 at least 3,450 people were killed in motor vehicle crashes involving distracted drivers, including those who were texting and driving#usdot #nhtsa #bens_law https://t.co/HgNzkoLL7o"
1113931516013244416b,2 friends in a week. texting & driving really gotta stop! 😞
1113931840543498241c,April is National Distracted Driving Awareness Month. The U.S. Department of Transportation’s (USDOT) National Highway Traffic Safety Administration (NHTSA) is mobilizing law enforcement officers nationwide to look out for drivers texting or using their phone behind the wheel. https://t.co/ddnYLIY6f8
1113933305534136320d,@MakkieHuskkie Touch screen made texting and driving difficult for me lol.
1113934607890755584e,NO: Officers are investigating a fatal crash. YES: Officers are investigating a deadly crash.  NO: The situation is fluid right now. YES: The situation is changing quickly.  NO: Texting-&-driving caused the car accident. YES: Texting-&-driving caused the wreck.  #WriteLikeYouTalk
1113934742225862656f,@KiraaQuintrel That stupid bitch was texting and driving
1113935071650533376g,"being tailgated by a dude speeding, texting and driving, and smoking a blunt"
1113935598153273344h,@LaurenPozenWSB Everywhere I went today people were driving and texting.  They did not care who saw them and only a few were from out of state.
1113936867634892800i,RT @GlennBurnsWSB: @LaurenPozenWSB Everywhere I went today people were driving and texting.  They did not care who saw them and only a few…
1113936985771659264j,"#DYK 94% of teen drivers acknowledge the dangers of texting and driving, but 35% still admit to doing it anyway? Don't become a statistic. #DistractedDrivingAwarenessMonth #W82txt #JustDrive #EndDistractedDriving"
1113938520656183296k,You sure do and I listen to most of them!!! Be safe out there -Lots of crazies out there texting and driving probably tweeting https://t.co/8xz7xKXORf
1113939146433863685l,@tmoneymanc299 @SamViscardi Its on purpose when your break every commin sense rule of the road. You shouldnt be texting and driving and you shouldnt be drinking and driving. She was doing both. This death highlights why those things are illegal. Cool try. Shes still a pos
1113940791456600064m,Maybe his transmission wont go in forward? I Dnk but seems to me his driving better then anyone on fone or texting? https://t.co/BX4qqU7wdK
1113943897108094977n,Check out: Texting bans linked to a decrease in car-crash injuries in ERs - Autoblog https://t.co/MM3rNMphqf via @therealautoblog
1113944534600306688o,officer: were you texting and driving?  me: no sir i was deleting low engagement tweets
1113945457523183617p,RT @CollinIngram: officer: were you texting and driving?  me: no sir i was deleting low engagement tweets
1113945649593102336q,Put your cellphone away. Please refrain from calling or texting while driving. Drive Safely! #SMCTollways . https://t.co/1RvK4MRMUk
1113949528309342213r,I hate when I see people texting and driving 😡😡  (Tweet posted from the fast lane of I-71N)
1113950094074699777s,"Santa Clarita deputies issued nearly 90 citations for cell phone use last week, just before the start of Distracted Driving Awareness Month. #texting #textinganddriving #CaliforniaHandsFree #textingcitations #LASD  See more: https://t.co/tzGBSFzzSC https://t.co/5pMAoRGRGO"
1113955648067309568t,Next time you’re texting and driving you should drive into a ditch and kill yourself.   ☕️
1113956182367059969u,"Well fuck. That's what I get for texting and driving. But fuck yes to answer your question, @josemangin"
1113957752785780736v,"RT @KYTC: One “LOL” or “SMH” could change your life forever.  You could end up in jail, injured, or dead. Remember: If you’re texting, you’…"
1113957989042540545w,"Indeed. Driving #Intexticated can tear families apart :( My childhood best friend was killed by a texting driver, summer 2017 https://t.co/hwr4zmUz5s"
1113958173025738752x,"It is unthinkable, and tragic. Next week is workzone safety week - distracted driving also kills workers via workzone intrusion AND struck by equipment they are working in the area with. Stay off the phones, stop texting...get enough sleep, don’t drink & drive... etc., etc., etc. https://t.co/yUXGY1Lnzq"
1113959298076274689y,"RT @thevoice_e: As a Mayoral Candidate, When it come to Vehicle vs a Pedestrian. Most Drivers driving in San Francisco are always rushing a…"
1113959895978655744z,@Maggie_Marie6 A hundred year old blind dog texting while driving and drinking a smoothie?
1113960859947151360a,Driving seven hours to the mountains tonight and still haven’t left. If you need a late night texting buddy let me know. 😂😂
1113961290551132165b,"RT @DCjagTV: As prom approaches, students are faced with decisions that impact the rest of their lives.  Please remember drinking and drivi…"
1113961798145675264c,RT @FrankFabian63: @1RU4real @_RainyDayWoman Maybe concentrate on banning texting and driving?  Kills more people than guns...by far.
1113962573873991681d,@TypingNonsense @CrystleMcAuli16 @TwitchReTweets @SSS_Discord_RTs @CaitSailor @Nekokittens @EmoSupportPanda @helmartwork @LittleKitten358 Not you though can texting watching a live video while driving is well... a bit dangerous. Lol
1113964490750603264e,@rrstar I think talking on phone or texting will driving should be a automatic jail sentence!!!!!!!!!
1113966231613321217f,"I just passed a lady with a pill bottle in her left hand, texting with both thumbs, driving with her knees, with her cab light on in her Prius....   Not sure if I should shake my head or salute her? Clap maybe?"
1113966673063579649g,"RT @sloyoroll01973: So, I learned a few things today. 1. People are still texting while driving, 2. I figured out why people are ""uncomfort…"
1113966940559638535h,he called me out for texting and driving and said if imma be dangerous I should be dangerous by talking to him. I’m dead lol
1113968256640081920i,"“States where it’s illegal to text while driving may have safer roads, according to a U.S. study that tracked declines in crash-related emergency room visits after these laws took effect.” https://t.co/fTIej0UoZd"
1113969722091900928j,eating and driving is dn just as distracting as texting
1113970373119422464k,@RohanSeinor @realDonaldTrump @ByronYork Texting and driving kills more people the guns do.
1113970476878053376l,A new study suggests that texting bans reduce visits to the emergency room.   https://t.co/eOytmXJe91
1113971513185701888m,State Texting-While-Driving Bans Cut Crash-Related ED Visits - https://t.co/D2zptvFSlY https://t.co/hEhn54wAhH
1113971604801720321n,@IllicitScript_ @holy_jello @xforcades4 @JordynPreuss This is exactly why texting and driving should be legal🙄
1113972031165476864o,"Distracted driving: From texting to daydreaming, police warn against crash causers https://t.co/KS0g2Riiad"
1113972223499481088p,@EricaMarieeee Hope you not texting and driving .
1113973622631215104q,FADD Fact of the day:  11 teens die everyday due to texting & driving.  😢  Think about the parents tonight who are living the ultimate nightmare.
1113974247339302912r,@jafranco88 No dad I’m not texting and driving.
1113974433750892552s,"Eye opening video on dangers of texting & driving. CLICK FOLLOWING LINK, THEN SCROLL DOWN TO WATCH REPORT AT: https://t.co/ccVAtEaoaS https://t.co/wrqigwVwz5"
1113975095679000576t,@RachelLMPerez Dead Cell : a psychic thriller to keep you from texting and driving. https://t.co/40U7gHB3Dv
1113976039049314306u,@Hbt102 @lissabradshaw I'm sure she was texting while driving
1113978051384107008v,Dude with a pnp badge texting and driving? Shocking.
1113978443849445376w,How is texting and driving illegal but the cops got a whole laptop in the car 😂😂😂
1113980671352016896x,RT @shareFADD: FADD Fact of the day:  11 teens die everyday due to texting & driving.  😢  Think about the parents tonight who are living th…
1113983151699787776y,RT @MayanBulnes: Saginaw police to ticket anyone seen texting while driving as part of special enforcement effort https://t.co/iDfjPq7f9t
1113983464993431552z,@ImPERILP Stop texting n driving guy
1113984625318215680a,"If you’re on the phone, you better not be behind the wheel. https://t.co/t4GlZFCYtg"
1113988092837400578b,@HatterBanter @TMMamaDrama And he's texting and driving.
1113991116364419072c,"If you want to stay out of the ER, put down the phone while you’re driving. https://t.co/mzc3rrALoU"
1113992482696482816d,RT @hallebenasherrr: just witnessed a cop texting while driving IM HEATED
1113993270722322432e,It should be illegal not to wear proper shoes while driving. What a stupid ruling. What’s next? Texting and driving is ok “unless you cause an accident” ONCE YOU CAUSE AN ACCIDENT IT IS TOO LATE. THE LAW IS SUPPOSED TO PREVENT ACCIDENTS IN THE FIRST PLACE... https://t.co/A6PCm3IJEo
1113994575138287616f,Bans on texting while driving tied to drop in ER visits for US crash injuries https://t.co/pxbYlIqBcq https://t.co/ywumtShKWU
1113994998251266053g,"RT @RedmondWaPD: Wow, there are a lot of folks driving dangerously today! Just this morning our Traffic Team stopped 72 drivers & gave 58 t…"
1113995171560067073h,"~Gif Starter~  @QueenBeeOfRHS   She never imagine she would find herself driving across the country all due to a S.O.S from Ally. Pulling up on the curb, seeing a light on inside the quant house on the Beacon Heights campus. Pulling out her phone and quickly texting a message --"
1113995527178338304i,For when @paolanicole1234 is texting and driving reckless 🙂 https://t.co/eFpuCC9VN9
1113995785425829888j,RT @WriteLikeUTalk: NO: Officers are investigating a fatal crash. YES: Officers are investigating a deadly crash.  NO: The situation is flu…
1113996810740281345k,Dayum.. You really can die from texting and driving... I just died in GTA5... Never thought it could happen.  🤔 They were right all along. 🤔🧐
1113997994112634880l,RT @SkywaySOMCO: Put your cellphone away. Please refrain from calling or texting while driving. Drive Safely! #SMCTollways . https://t.co/j…
1113999259487965185m,*texts and drives  *almost crashes into a tree  *continues texting and driving
1113999702192807937n,"By making it a primary offense, police could pull over motorists solely for texting while driving.   https://t.co/reogqerZO7"
1114000055776706561o,"The National Safety Council reports that cellphone use while driving leads to 1.6 million crashes each year. Nearly 390,000injuries occur each year from accidents caused by texting while driving. 1 out of every 4 car accidents in the US is caused by texting and driving. @000RVA"
1114003577104666625p,@GayHateAlliance i knew a girl in grade school who ate her boogers and then in highschool she ran over and killed a guy while texting and driving
1114005002320793600q,Y’all we really gotta drive for us and the other people on the highway smh. Y’all please be careful & put y’all phones down. No texting and driving please 😩
1114005589728698368r,RT @thomasgabriel43: *texts and drives  *almost crashes into a tree  *continues texting and driving
1114005648797196288s,"Texting and driving slogan goes - It can wait? Oh really? How do you know my life?? What else can you tell me about me? I actually need help, come on you got the goods don’t hold out on me tell me!!!!"
1114005721367097344t,"You know you trust your car’s driving ability too much when you texting and driving , drinking, speeding, and checking social media...."
1114006601915084802u,RT @OhMikki_J: Y’all we really gotta drive for us and the other people on the highway smh. Y’all please be careful & put y’all phones down.…
1114006896338505728v,@HoosierFooDog no texting while driving ho
1114007705440653313w,The best part of my day was walking home from the library at 9:30pm and seeing a city bus with this message displayed “texting and driving? ...CELL no”   It was a rough day.
1114008423065116674x,Proposal looking to make texting while driving primary offense https://t.co/8WGYUdrUBN
1114011413700317184y,RT @_AmberSkyes_: Dayum.. You really can die from texting and driving... I just died in GTA5... Never thought it could happen.  🤔 They were…
1114014424631660545z,"My Uber driver is texting and driving, which is super cool & safe."
1114014484476125184a,One of my biggest fears is that I die in a car crash for texting and driving and when my mom checks my phone after I’m dead my last text reads “Lemme sit on that dick and spin on it” or “I wanna swallow your dick whole”...
1114016970955870209b,@Grown_simbaaa $1000 ticket for texting and driving
1114017129827831808c,"Me: Not trying to be a dick, how do you get into 4 accidents on a 5 day trip? Her: Well I was tailgating someone and hit him... another time I was texting. Me: Soo that means YOU suck at driving😂, you probably should have rode a bike. Sorry.  🗑🐱still follows me on IG😂😂"
1114018068454412288d,"@notallgeminis i had a dream i was on a plane that finally landed we were like driving to ? park or whatever planes do,we were landed on a beach shore,no one realised,everyone is texting saying we landed(joy) and then the pilot turns and drives us right into the ocean and the waves,we drowned."
1114018639106146308e,I SHOULDN’T BE TEXTING AND DRIVING BUT THIS ALBUM FUCKKKK @thegreatkhalid
1114021656782168064f,"Phone convo b/t me and dad Me: “so I gave up a couple things for lent, but the main one is not texting & driving” Dad: Me: Dad: Me: “so are u proud of me or what” Dad: “uhh ya super proud that my daughter gave up violating the law for 40 days.”"
1114022173889445888g,"@AjD3V @BryceYTS @cqrcmp Well they have more pros than cons. They will be able to see if someone has, been texting and driving, ran a red light, sped (only certain ones can do this that I have seen), and probably the best part, they can see who actually caused the accidents and what they did to do so."
1114022724219867137h,"@Rachel__Bush also, according to the CDC abortion is not this #1 cause of death, which would mean statistically accidents are the #3 cause of death nationally. You should probably stop texting and driving because it’s dangerous and idiotic. https://t.co/YLMGzZ3miE"
1114027595950170112i,"@Slinky_The_Cat @TinyPearlCat @moothemousecat @cobalttash @CinniMini2 Yeah it’s crummy  _ now I’m driving in the pouring rain I’m using the voice activation so better than texting but I still should be paying Maybe I’ll check when I get home and see if any late night pawtiers Are still up , otherwise hopes to see you next week! #nipclub"
1114028124356972549j,"I fail to understand how texting and driving is illegal but putting on a full face of make-up, on the highway, with your kids in the car is okay?"
1114030172154605570k,"You think you can manage multi-tasking? Not behind the wheel. If you’re texting, you’re not driving. #JustDrive #DZD https://t.co/fB5VXXr8i3"
1114035552930500612l,@igoistkaren i was texting my bro when our dad was driving lmaooooo
1114038585500372992m,@LakesPlace @LeonardRoxon @i_stormwatch I’ll smoke if I want.  Take a drink when I choose and eat a Timbit if I please and to fucking bad.    Texting and driving is the problem this is just stealing money for there budgets
1114040877029019648n,"@NBCian @nbcbayarea First, enforce the law as-is. Everyday, 70% of the people I see on my daily commute are texting and driving."
1114043476872769536o,So many tweets about #5G and #death !!! The scientific level in that world is scarring me ! To be clear the only proven relation with #5G and death are texting while driving like for #2G #3G #4G.
1114047447981072384p,"@VioletIrwin76 Michigan has been like that for a few days now, one chick I was behind rode a semi and I mean rode it where if brake lights lit up she was hitting it, people going 10-15 under, people swerving all over texting and driving. I'm just there in my civic praying that I come out alive."
1114052818263007232q,RT @i_slaydrian: One of my biggest fears is that I die in a car crash for texting and driving and when my mom checks my phone after I’m dea…
1114055095304347650r,"When I see a lady driving a car, and her seat is pushed up really close to the steering wheel, and her boyfriend is reclined almost horizontally in the passenger seat and texting, I immediately think, ""He's using her, and she hasn't realized it yet."" #saviorcomplex"
1114055454005563392s,"So can people in Michigan please for the love of all that is good STOP TEXTING AND DRIVING, it is daily that I'm almost ran off the road or watching other people have to swerve cause the idiot next to them isnt paying attention. We have families, friends, pets we'd like to see."
1114056372851810304t,"“If you text and drive, insurers consider you a liability.”  https://t.co/YW00pnML2F"
1114063876759478273u,So now we can get a ticket not just for texting and driving but for eating and driving🤣 and using the gps
1114065677885767680v,@WAVY_News Hell they can’t enforce the no texting or email while driving now. No need for laws if the cops are not gonna enforce it. A no cell phone bill is a great law to pass but the idiots in Richmond are so behind in the times they can’t pass this make sense bill/law.
1114068055456243712w,"Just because im good at texting and driving doesn’t mean y’all should be trying, too #frfr"
1114069559911297025x,@MinxLinda73 @Devildog683 Oh you see it on 985 also !!! My hubby sees it every morning around 7-730 going to work southbound from flowery branch to Suwannee on 85.  So sad. They should arrest for stupidity on top of texting and driving !!! Hope that Officer was okay
1114071900613951488y,RT @veillepr: Advert warns of dangers of texting and driving | The Royal Gazette:Bermuda Drive For Change - Mobile A hard-hitting road safe…
1114074364633321472z,"My @DragonTaxisCDF driver is texting while driving, what a lovely start to the day 🙃😫"
1114082800955793408a,"Texting and driving can wreck your life because if you're texting, you're not driving. Don't let it. #DistractedDrivingAwarenessMonth #headsupgeorgia #drivealert https://t.co/7MeTvqTzPD"
1114082935936831488b,The #GalaxyS10 hands free would help me because I'm always in the car & obviously NO texting/calls while driving. My car doesn't have bluetooth so this will definitely help me A LOT. I can make important calls and listen to good music without using the phone @samsungmobilesa @947 https://t.co/aEeS1tnFeH
1114090697437536256c,"(Reuters Health) - States where it's illegal to text while driving may have safer roads, according to a U.S. study that tracked declines in crash-related emergency room visits after these laws took effect. https://t.co/U2kKCxwgAd https://t.co/ERvN8daGLu"
1114097183677124609d,"Since GA outlawed texting and driving,  the number of accidents cause by distracted drivers has gone up. Curious."
1114105396900315137e,Here are the main reasons you should not text and drive. Stay safe on the road ladies and fellas. 🙏🏽🚘  https://t.co/O6LbTYkTj8
1114106668932055040f,"Distracted driving killed 3,450 people in 2016 — an increase of 8 percent since 2014. The number of fatalities may well be higher due to difficulties identifying distraction-related crashes https://t.co/3cjlkJAovw"
1114106856350392321g,RT @emmasonny1123: I see 110% more adults texting and driving than teenagers
1114108889384083456h,"Keep up the boozing, dabbing, vaping, unsafe sex, texting while driving, & speeding. You are killing yourself but it looks like way more fun than I am having #UnlikelyDoctorAdvice"
1114115776699617280i,RT @Power1051: Here are the main reasons you should not text and drive. Stay safe on the road ladies and fellas. 🙏🏽🚘  https://t.co/O6LbTYkT…
1114118285828730881j,@thoughtsof37 @DoveTeeeth @davidhogg111 more people die in cars than in mass shootings. 3500 teens are killed each year texting while driving. Its time we ban cell phone usage in cars Oh wait they already have
1114119497164701698k,@davidhogg111 more people die in cars than in mass shootings. 3500 teens are killed each year texting while driving
1114119572351848449l,@uSihle_ Texting and driving smh bmw drivers
1114123638113034241m,RT @990Rss: @DRIVESMARTVA @GovernorVA @SenMMason @RichardStuartVA @vafrankwagner @ssurovell @TommyNorment @VASenate @VaHouse National Safet…
1114127923412381696n,"@factsmatter2020 @NRA @HawaiiRifleAsso Americans are 3x more likely to die from drunk driving and texting than gun crime. Ban cars and phones, which are not protected by the constitution."
1114128125963771904o,"April is Distracted Driving Awareness Month. There are 3 types of distractions: VISUAL, MANUAL & MENTAL. Texting while driving involves all three and is dangerous and against the law. #JustDrive #W82TXT https://t.co/mCiSE0xHh9"
1114129164041359360p,"@jamiewestndp Quick, ""union bosses,"" while you've got these students' full attention and obedience, please remind them to stay away from cigarettes and avoid texting while driving. Thank you for using your hypnotic power over teens responsibly."
1114129884929044480q,@greggrunberg Texting and driving
1114131442534166528r,"PSA: stop texting and driving. You are putting yourself, and the other is on the road at risk when you do it. I cannot tell you how many people on my way to work I see texting and nearly get into accidents. It’s astonishing. Please stop"
1114131792808660998s,"@KKuhtoons I mean texting and driving has gotten even worst then drunk driving like it’s the new form of drunk driving esensually, like if ppl are going to be idiots by texting and driving and not paying attention at all then they shouldn’t be driving"
1114135747127324672t,"@christianwolmar @RaggyJha @w4hammer Exactly. Your asking someone to go from 0 to 100 in a split second, and expect that to work? If that’s so easy, why are there laws against using cellphones and texting while driving. If you don’t need to be 100% alert and in control."
1114137928727449600u,"@lizbethkb please pass a law making texting while driving a primary offense.  I walk, run and bike in FL and EVERY morning, at least one car veers into the bike lane despite markings.  Often the driver appears to be texting. Recently one vehicle drove onto the sidewalk. Help!!!"
1114139378765451270v,@StoptheTexts @omatrafficalert It would be helpful if the @UnicamUpdate could update the Texting and Driving law to make it a primary offense.
1114140265973997569w,"We are getting automatic transmissions put in our new trucks at work. It will make texting, eating and drinking while driving a lot easier. 🚚"
1114140853944102912x,“I swear if I see another person texting and driving on the Garden State Parkway I’m going to throw my beer at them”
1114141801739239424y,Don’t pretend like you never exit/close texting apps as quickly as you can when you see that someone is “typing...” for a while. That shit is more nerve racking than driving right next to an oil tanker 👀
1114143789428424704z,If I see one more damn person texting and driving I’m gonna start rolling down my window and throwing my beer at them
1114143812950134785a,Let’s hope this year the Fl Legislature finally makes texting while driving a primary offense.  https://t.co/QWaZq8AKsa
1114144070941716480b,PCHS Senior Bryson Dent says NO to texting and driving...Go Trojans! https://t.co/6kBDwSP0B5
1114146182924627968c,RT @hrsco21_rich: @LakesPlace @LeonardRoxon @i_stormwatch I’ll smoke if I want.  Take a drink when I choose and eat a Timbit if I please an…
1114146368543645697d,"Noticed only about 20 people driving today, 80 km/h + with their heads down on their phones.  Not smart!!!!  Wake up people:  stop texting and driving.  You're in a killing machine.  #otttraffic"
1114148133682929665e,"RT @TJBoyd07: Texting while driving, being stupid and driving etc. should all have the same penalty as drunk driving, which should be fucki…"
1114148414831382528f,"@KyleKashuv @KurtSchlichter Not that it’s an insignificant problem, but that comes out to 547 people a year in a country of 300 million. Now do drunk driving, texting while driving and bathtub falls."
1114149414069731328g,"RT @realstevetrev: New Jersey texting while driving ticket blitz starts today. If you were going to send a short text to Governor Murphy, w…"
1114149686682750976h,Can’t stand when people wanna fly through school zones while texting and driving like no mames slow tf down
1114149909249314816i,@SafeDrivePodCAD @dorisaveslives @Safedrivepod That's a great idea !!! People definitely need to wake up and understand the danger of texting and driving.
1114150417850675201j,@TinaOHSen3 Please quit texting and driving.
1114152062160441344k,"According to @NHTSAgov, 3,450 people were killed in motor vehicle crashes involving distracted drivers in 2016. There’s still a lot of work to do! What can you do to prevent texting and driving? #justdrive https://t.co/rdAXDKPAVf"
